{
  "isRemote": false,
  "systemInfo": {
    "operatingSystem": "darwin",
    "timestamp": "2025-11-19T05:48:45.683Z",
    "userEmail": "yadavabhi2828@gmail.com",
    "userName": "Yadav Abhishek"
  },
  "userSettings": {
    "userSettings": {
      "openMostRecentChatConversation": true,
      "lastSelectedModel": 0,
      "themePreference": 0,
      "extensionPanelTab": 0,
      "fontSize": 0,
      "rememberLastModelSelection": 0,
      "autocompleteSpeed": 0,
      "lastSelectedModelName": "",
      "googleAgentNuxStates": [],
      "seenNuxUids": {},
      "lastSelectedgoogleAgentModel": 1007,
      "googleAgentAllowedCommands": [],
      "googleAgentDeniedCommands": [],
      "userNuxStates": [],
      "googleAgentWebSearchDisabled": false,
      "tabEnabled": 0,
      "disableSelectionPopup": false,
      "disableExplainProblemInlayHint": false,
      "disableInlayHintShortcuts": false,
      "disableOpengoogleAgentOnReload": false,
      "disableAutoOpenEditedFiles": false,
      "disableTabToJump": false,
      "googleAgentAutoExecutionPolicy": 3,
      "explainAndFixInCurrentConversation": false,
      "allowgoogleAgentAccessGitignoreFiles": false,
      "allowAgentAccessNonWorkspaceFiles": false,
      "disablegoogleAgentAutoFixLints": false,
      "disablegoogleAgentBrowserPreviews": false,
      "detectAndUseProxy": 0,
      "disableTabToImport": false,
      "useClipboardForCompletions": false,
      "disableHighlightAfterAccept": false,
      "lastSelectedNewConvoTab": "",
      "disableAutoGenerateMemories": false,
      "enableSoundsForSpecialEvents": false,
      "enableTabSounds": false,
      "allowgoogleAgentInBackground": false,
      "tabToJump": 0,
      "googleAgentWebSearch": 0,
      "enableTerminalCompletion": false,
      "isSnoozed": false,
      "featureUsageData": {},
      "disablegoogleAgentInBackground": false,
      "customWorkspace": [],
      "conversationBrainConfigs": {},
      "globalPlanModePreference": 0,
      "cachedgoogleAgentModelConfigs": [],
      "cachedgoogleAgentModelSorts": [],
      "googleAgentRunExtensionCode": 0,
      "googleAgentRunExtensionCodeAutoRun": 0,
      "googleAgentInputAutocomplete": 0,
      "autoContinueOnMaxGeneratorInvocations": 0,
      "recentlyUsedgoogleAgentModels": [
        "1007",
        "333"
      ],
      "annotationsConfig": 0,
      "enableAutomaticScreenshot": false,
      "relativeWorkingDirPaths": [],
      "customModels": {},
      "disableCodeSnippetTelemetry": false,
      "planningMode": 0,
      "agentBrowserTools": 0,
      "artifactReviewMode": 2,
      "browserOnboarded": false,
      "allowTabAccessGitignoreFiles": false,
      "browserChromePath": "",
      "browserUserProfilePath": "",
      "browserCdpPort": 0,
      "demoModeEnabled": false,
      "browserJsExecutionPolicy": 0
    }
  },
  "extensionLogs": [
    "2025-11-19 10:38:31.017 [info] 2025/11/19 10:38:31 maxprocs: Leaving GOMAXPROCS=8: CPU quota undefined",
    "2025-11-19 10:38:31.126 [info] I1119 10:38:31.126393  1552 main.go:183] Setting GOMAXPROCS to 4",
    "2025-11-19 10:38:31.127 [info] I1119 10:38:31.127634  1552 main.go:294] Starting language server process with pid 1552",
    "2025-11-19 10:38:31.128 [info] I1119 10:38:31.127963  1552 server.go:228] Language server will attempt to listen on host 127.0.0.1",
    "2025-11-19 10:38:31.128 [info] I1119 10:38:31.128603  1552 server.go:235] Language server listening on random port at 49333 for HTTPS",
    "2025-11-19 10:38:31.128 [info] I1119 10:38:31.128626  1552 server.go:242] Language server listening on random port at 49334 for HTTP",
    "2025-11-19 10:38:31.498 [info] I1119 10:38:31.498605  1552 server.go:326] Created extension server client at port 49332",
    "2025-11-19 10:38:31.509 [info] W1119 10:38:31.508860  1552 log_context.go:106] Cache(userInfo): Singleflight refresh failed: You are not logged into Antigravity.",
    "2025-11-19 10:38:31.518 [info] I1119 10:38:31.518772  1552 server.go:343] initialized server successfully",
    "2025-11-19 10:38:31.520 [info] W1119 10:38:31.520371  1552 log_context.go:106] Cache(userInfo): Singleflight refresh failed: You are not logged into Antigravity.",
    "2025-11-19 10:38:31.527 [info] (Antigravity) 2025-11-19 10:38:31.527 [INFO]: Language server started",
    "2025-11-19 10:38:31.555 [info] 2025/11/19 10:38:31 http: TLS handshake error from 127.0.0.1:49350: EOF",
    "2025-11-19 10:38:31.555 [info] 2025/11/19 10:38:31 http: TLS handshake error from 127.0.0.1:49349: EOF",
    "2025-11-19 10:38:31.580 [info] (Antigravity) 2025-11-19 10:38:31.580 [INFO]: LS lspClient started successfully",
    "2025-11-19 10:38:35.742 [info] 2025/11/19 10:38:35 maxprocs: Leaving GOMAXPROCS=8: CPU quota undefined",
    "2025-11-19 10:38:35.785 [info] I1119 10:38:35.776051  1696 main.go:183] Setting GOMAXPROCS to 4",
    "2025-11-19 10:38:35.785 [info] I1119 10:38:35.776515  1696 main.go:294] Starting language server process with pid 1696",
    "2025-11-19 10:38:35.785 [info] I1119 10:38:35.776531  1696 server.go:228] Language server will attempt to listen on host 127.0.0.1",
    "2025-11-19 10:38:35.785 [info] I1119 10:38:35.776598  1696 server.go:235] Language server listening on random port at 49358 for HTTPS",
    "2025-11-19 10:38:35.785 [info] I1119 10:38:35.776617  1696 server.go:242] Language server listening on random port at 49359 for HTTP",
    "2025-11-19 10:38:36.159 [info] I1119 10:38:36.159029  1696 server.go:326] Created extension server client at port 49357",
    "2025-11-19 10:38:36.161 [info] W1119 10:38:36.161717  1696 log_context.go:106] Cache(userInfo): Singleflight refresh failed: You are not logged into Antigravity.",
    "2025-11-19 10:38:36.166 [info] I1119 10:38:36.166583  1696 server.go:343] initialized server successfully",
    "2025-11-19 10:38:36.167 [info] W1119 10:38:36.167099  1696 log_context.go:106] Cache(userInfo): Singleflight refresh failed: You are not logged into Antigravity.",
    "2025-11-19 10:38:36.175 [info] (Antigravity) 2025-11-19 10:38:36.175 [INFO]: Language server started",
    "2025-11-19 10:38:36.203 [info] 2025/11/19 10:38:36 http: TLS handshake error from 127.0.0.1:49374: EOF",
    "2025-11-19 10:38:36.203 [info] 2025/11/19 10:38:36 http: TLS handshake error from 127.0.0.1:49375: EOF",
    "2025-11-19 10:38:36.225 [info] (Antigravity) 2025-11-19 10:38:36.225 [INFO]: LS lspClient started successfully",
    "2025-11-19 10:51:27.291 [info] (Antigravity) 2025-11-19 10:51:27.291 [INFO]: [SupercompleteProvider] No supercomplete response",
    "2025-11-19 10:51:27.968 [info] (Antigravity) 2025-11-19 10:51:27.968 [INFO]: [SupercompleteProvider] No supercomplete response",
    "2025-11-19 10:53:48.217 [info] (Antigravity) 2025-11-19 10:53:48.216 [INFO]: [Terminal] Command completed: python 1.py exit code 127",
    "2025-11-19 10:55:11.870 [info] (Antigravity) 2025-11-19 10:55:11.870 [INFO]: [Terminal] Command completed: python3 1.py",
    " exit code 0",
    "2025-11-19 11:04:10.757 [info] E1119 11:04:10.757437  1696 log.go:354] encountered conflicting override on experiment: googleAgent-knowledge-config",
    "2025-11-19 11:04:10.801 [info] I1119 11:04:10.801077  1696 planner_generator.go:271] Requesting planner with 2 chat messages at model retry attempt 1 and API retry attempt 1",
    "2025-11-19 11:04:17.788 [info] I1119 11:04:17.788494  1696 http_helpers.go:125] URL: https://daily-cloudcode-pa.sandbox.googleapis.com/v1internal:streamGenerateContent?alt=sse Trace: 0x497908df95d85353",
    "2025-11-19 11:04:28.132 [info] E1119 11:04:28.132092  1696 log.go:354] argument order was not respected: [TargetFile Overwrite] vs [ArtifactMetadata CodeContent Complexity Description EmptyFile IsArtifact Overwrite TargetFile]",
    "2025-11-19 11:04:28.145 [info] E1119 11:04:28.144742  1696 log.go:354] argument order was not respected: [TaskName Mode PredictedTaskSize] vs [Mode PredictedTaskSize TaskName TaskStatus TaskSummary]",
    "2025-11-19 11:04:28.299 [info] I1119 11:04:28.299759  1696 planner_generator.go:271] Requesting planner with 5 chat messages at model retry attempt 1 and API retry attempt 1",
    "2025-11-19 11:04:30.291 [info] I1119 11:04:30.291528  1696 http_helpers.go:125] URL: https://daily-cloudcode-pa.sandbox.googleapis.com/v1internal:streamGenerateContent?alt=sse Trace: 0x869b685fa26a4dc6",
    "2025-11-19 11:04:34.169 [info] I1119 11:04:34.169356  1696 http_helpers.go:125] URL: https://daily-cloudcode-pa.sandbox.googleapis.com/v1internal:streamGenerateContent?alt=sse Trace: 0x220c86427aa68ebe",
    "2025-11-19 11:04:46.685 [info] E1119 11:04:46.685399  1696 log.go:354] argument order was not respected: [TargetFile Overwrite] vs [ArtifactMetadata CodeContent Complexity Description EmptyFile IsArtifact Overwrite TargetFile]",
    "2025-11-19 11:04:46.755 [info] E1119 11:04:46.751983  1696 log.go:354] argument order was not respected: [PathsToReview BlockedOnUser] vs [BlockedOnUser ConfidenceJustification ConfidenceScore Message PathsToReview waitForPreviousTools]",
    "2025-11-19 11:04:46.785 [info] I1119 11:04:46.781721  1696 planner_generator.go:271] Requesting planner with 10 chat messages at model retry attempt 1 and API retry attempt 1",
    "2025-11-19 11:04:53.831 [info] I1119 11:04:53.830568  1696 http_helpers.go:125] URL: https://daily-cloudcode-pa.sandbox.googleapis.com/v1internal:streamGenerateContent?alt=sse Trace: 0x45644f7dfe014fc1",
    "2025-11-19 11:04:58.338 [info] E1119 11:04:58.337460  1696 log.go:354] argument order was not respected: [TaskName Mode PredictedTaskSize] vs [Mode PredictedTaskSize TaskName TaskStatus TaskSummary]",
    "2025-11-19 11:04:59.463 [info] E1119 11:04:59.463235  1696 log.go:354] argument order was not respected: [TargetFile] vs [CodeMarkdownLanguage Complexity Description Instruction ReplacementChunks TargetFile]",
    "2025-11-19 11:05:18.228 [info] E1119 11:05:18.228536  1696 log.go:354] argument order was not respected: [TargetFile Overwrite] vs [ArtifactMetadata CodeContent Complexity Description EmptyFile IsArtifact Overwrite TargetFile]",
    "2025-11-19 11:05:18.279 [info] E1119 11:05:18.279806  1696 log.go:354] argument order was not respected: [TargetFile Overwrite] vs [ArtifactMetadata CodeContent Complexity Description EmptyFile IsArtifact Overwrite TargetFile]",
    "2025-11-19 11:05:22.275 [info] I1119 11:05:22.275346  1696 planner_generator.go:271] Requesting planner with 14 chat messages at model retry attempt 1 and API retry attempt 1",
    "2025-11-19 11:05:34.391 [info] I1119 11:05:34.390527  1696 http_helpers.go:125] URL: https://daily-cloudcode-pa.sandbox.googleapis.com/v1internal:streamGenerateContent?alt=sse Trace: 0x290890f9850440b6",
    "2025-11-19 11:05:40.028 [info] E1119 11:05:40.027781  1696 log.go:354] argument order was not respected: [TaskName Mode PredictedTaskSize] vs [Mode PredictedTaskSize TaskName TaskStatus TaskSummary]",
    "2025-11-19 11:05:40.630 [info] E1119 11:05:40.630002  1696 log.go:354] argument order was not respected: [TargetFile] vs [CodeMarkdownLanguage Complexity Description Instruction ReplacementChunks TargetFile]",
    "2025-11-19 11:05:41.201 [info] I1119 11:05:41.201701  1696 planner_generator.go:271] Requesting planner with 18 chat messages at model retry attempt 1 and API retry attempt 1",
    "2025-11-19 11:05:47.183 [info] I1119 11:05:47.183506  1696 http_helpers.go:125] URL: https://daily-cloudcode-pa.sandbox.googleapis.com/v1internal:streamGenerateContent?alt=sse Trace: 0x180de9efec1205c5",
    "2025-11-19 11:05:56.202 [info] (Antigravity) 2025-11-19 11:05:56.202 [INFO]: [Terminal] Command completed: pip install -r requirements.txt && python fraud_detection.py exit code 127",
    "2025-11-19 11:05:56.212 [info] I1119 11:05:56.212141  1696 planner_generator.go:271] Requesting planner with 20 chat messages at model retry attempt 1 and API retry attempt 1",
    "2025-11-19 11:06:02.746 [info] I1119 11:06:02.745807  1696 http_helpers.go:125] URL: https://daily-cloudcode-pa.sandbox.googleapis.com/v1internal:streamGenerateContent?alt=sse Trace: 0xd74d6446fb4d2db4",
    "2025-11-19 11:06:04.437 [info] E1119 11:06:04.437721  1696 log.go:354] argument order was not respected: [TaskName Mode PredictedTaskSize] vs [Mode PredictedTaskSize TaskName TaskStatus TaskSummary]",
    "2025-11-19 11:06:05.007 [info] I1119 11:06:05.006946  1696 planner_generator.go:271] Requesting planner with 23 chat messages at model retry attempt 1 and API retry attempt 1",
    "2025-11-19 11:06:11.507 [info] I1119 11:06:11.507515  1696 http_helpers.go:125] URL: https://daily-cloudcode-pa.sandbox.googleapis.com/v1internal:streamGenerateContent?alt=sse Trace: 0x6edaba8b51dbca1f",
    "2025-11-19 11:06:19.577 [info] (Antigravity) 2025-11-19 11:06:19.577 [INFO]: [Terminal] Command completed: python3 fraud_detection.py exit code 1",
    "2025-11-19 11:06:19.586 [info] I1119 11:06:19.586168  1696 planner_generator.go:271] Requesting planner with 25 chat messages at model retry attempt 1 and API retry attempt 1",
    "2025-11-19 11:06:27.203 [info] I1119 11:06:27.202922  1696 http_helpers.go:125] URL: https://daily-cloudcode-pa.sandbox.googleapis.com/v1internal:streamGenerateContent?alt=sse Trace: 0xc9a2e7e19f78fafc",
    "2025-11-19 11:06:30.280 [info] E1119 11:06:30.280081  1696 log.go:354] argument order was not respected: [TaskName Mode PredictedTaskSize] vs [Mode PredictedTaskSize TaskName TaskStatus TaskSummary]",
    "2025-11-19 11:06:30.363 [info] (Antigravity) 2025-11-19 11:06:30.363 [INFO]: [Terminal] Command completed: brew install libomp exit code 127",
    "2025-11-19 11:06:30.371 [info] I1119 11:06:30.371537  1696 planner_generator.go:271] Requesting planner with 28 chat messages at model retry attempt 1 and API retry attempt 1",
    "2025-11-19 11:06:37.357 [info] I1119 11:06:37.357590  1696 http_helpers.go:125] URL: https://daily-cloudcode-pa.sandbox.googleapis.com/v1internal:streamGenerateContent?alt=sse Trace: 0x34b4c05b01aef1c0",
    "2025-11-19 11:06:40.737 [info] E1119 11:06:40.737103  1696 log.go:354] argument order was not respected: [TaskName Mode PredictedTaskSize] vs [Mode PredictedTaskSize TaskName TaskStatus TaskSummary]",
    "2025-11-19 11:06:43.491 [info] E1119 11:06:43.491315  1696 log.go:354] argument order was not respected: [TargetFile] vs [AllowMultiple CodeMarkdownLanguage Complexity Description EndLine Instruction ReplacementContent StartLine TargetContent TargetFile]",
    "2025-11-19 11:06:43.551 [info] E1119 11:06:43.551388  1696 log.go:354] argument order was not respected: [TargetFile] vs [AllowMultiple CodeMarkdownLanguage Complexity Description EndLine Instruction ReplacementContent StartLine TargetContent TargetFile]",
    "2025-11-19 11:06:47.533 [info] I1119 11:06:47.532855  1696 planner_generator.go:271] Requesting planner with 32 chat messages at model retry attempt 1 and API retry attempt 1",
    "2025-11-19 11:06:55.278 [info] I1119 11:06:55.277435  1696 http_helpers.go:125] URL: https://daily-cloudcode-pa.sandbox.googleapis.com/v1internal:streamGenerateContent?alt=sse Trace: 0xad0d8b8f88c1c07d",
    "2025-11-19 11:06:56.250 [info] E1119 11:06:56.250789  1696 log.go:354] argument order was not respected: [TaskName Mode PredictedTaskSize] vs [Mode PredictedTaskSize TaskName TaskStatus TaskSummary]",
    "2025-11-19 11:06:56.827 [info] I1119 11:06:56.826892  1696 planner_generator.go:271] Requesting planner with 35 chat messages at model retry attempt 1 and API retry attempt 1",
    "2025-11-19 11:07:00.600 [info] (Antigravity) 2025-11-19 11:07:00.600 [INFO]: [Terminal] Command completed: python3 fraud_detection.py exit code 0",
    "2025-11-19 11:07:08.618 [info] I1119 11:07:08.618319  1696 http_helpers.go:125] URL: https://daily-cloudcode-pa.sandbox.googleapis.com/v1internal:streamGenerateContent?alt=sse Trace: 0xfd9033c3681b3af9",
    "2025-11-19 11:07:08.650 [info] I1119 11:07:08.650075  1696 planner_generator.go:271] Requesting planner with 37 chat messages at model retry attempt 1 and API retry attempt 1",
    "2025-11-19 11:07:15.143 [info] I1119 11:07:15.142808  1696 http_helpers.go:125] URL: https://daily-cloudcode-pa.sandbox.googleapis.com/v1internal:streamGenerateContent?alt=sse Trace: 0xeb0780434088e2fb",
    "2025-11-19 11:07:16.788 [info] E1119 11:07:16.788384  1696 log.go:354] argument order was not respected: [TaskName Mode PredictedTaskSize] vs [Mode PredictedTaskSize TaskName TaskStatus TaskSummary]",
    "2025-11-19 11:07:20.452 [info] E1119 11:07:20.452411  1696 log.go:354] argument order was not respected: [TargetFile] vs [CodeMarkdownLanguage Complexity Description Instruction ReplacementChunks TargetFile]",
    "2025-11-19 11:07:20.547 [info] I1119 11:07:20.547218  1696 planner_generator.go:271] Requesting planner with 41 chat messages at model retry attempt 1 and API retry attempt 1",
    "2025-11-19 11:07:27.198 [info] I1119 11:07:27.197670  1696 http_helpers.go:125] URL: https://daily-cloudcode-pa.sandbox.googleapis.com/v1internal:streamGenerateContent?alt=sse Trace: 0x5424632dc1968e0f",
    "2025-11-19 11:07:35.417 [info] (Antigravity) 2025-11-19 11:07:35.417 [INFO]: [Terminal] Command completed: cp roc_curves.png feature_importance_Random_Forest.png /Users/yadavabhishek/.gemini/antigravity/brain/6b60bae8-655a-44e6-92b8-e438ddbf4ed7/ exit code 0",
    "2025-11-19 11:07:38.744 [info] E1119 11:07:38.744054  1696 log.go:354] argument order was not respected: [TargetFile Overwrite] vs [ArtifactMetadata CodeContent Complexity Description EmptyFile IsArtifact Overwrite TargetFile]",
    "2025-11-19 11:07:38.802 [info] E1119 11:07:38.801965  1696 log.go:354] argument order was not respected: [PathsToReview BlockedOnUser] vs [BlockedOnUser ConfidenceJustification ConfidenceScore Message PathsToReview waitForPreviousTools]",
    "2025-11-19 11:08:09.421 [info] (Antigravity) 2025-11-19 11:08:09.421 [INFO]: [SupercompleteProvider] No supercomplete response",
    "2025-11-19 11:09:13.322 [info] (Antigravity) 2025-11-19 11:09:13.322 [INFO]: [SupercompleteProvider] No supercomplete response",
    "2025-11-19 11:09:34.088 [info] (Antigravity) 2025-11-19 11:09:34.088 [INFO]: [SupercompleteProvider] No supercomplete response",
    "2025-11-19 11:09:44.203 [info] (Antigravity) 2025-11-19 11:09:44.203 [INFO]: [SupercompleteProvider] No supercomplete response",
    "2025-11-19 11:09:47.215 [info] (Antigravity) 2025-11-19 11:09:47.215 [INFO]: [SupercompleteProvider] No supercomplete response",
    "2025-11-19 11:15:00.242 [info] (Antigravity) 2025-11-19 11:15:00.242 [INFO]: [SupercompleteProvider] No supercomplete response",
    "2025-11-19 11:18:41.516 [info] (Antigravity) 2025-11-19 11:18:41.516 [INFO]: [SupercompleteProvider] No supercomplete response"
  ],
  "mainThreadLogs": {
    "artifacts": []
  },
  "languageServerLogs": {
    "logs": [
      "I1119 10:38:35.776051  1696 main.go:183] Setting GOMAXPROCS to 4\n",
      "I1119 10:38:35.776515  1696 main.go:294] Starting language server process with pid 1696\n",
      "I1119 10:38:35.776531  1696 server.go:228] Language server will attempt to listen on host 127.0.0.1\n",
      "I1119 10:38:35.776598  1696 server.go:235] Language server listening on random port at 49358 for HTTPS\n",
      "I1119 10:38:35.776617  1696 server.go:242] Language server listening on random port at 49359 for HTTP\n",
      "I1119 10:38:36.159029  1696 server.go:326] Created extension server client at port 49357\n",
      "W1119 10:38:36.161717  1696 log_context.go:106] Cache(userInfo): Singleflight refresh failed: You are not logged into Antigravity.\n",
      "I1119 10:38:36.166583  1696 server.go:343] initialized server successfully\n",
      "W1119 10:38:36.167099  1696 log_context.go:106] Cache(userInfo): Singleflight refresh failed: You are not logged into Antigravity.\n",
      "E1119 11:04:10.757437  1696 log.go:354] encountered conflicting override on experiment: googleAgent-knowledge-config\n",
      "I1119 11:04:10.801077  1696 planner_generator.go:271] Requesting planner with 2 chat messages at model retry attempt 1 and API retry attempt 1\n",
      "I1119 11:04:17.788494  1696 http_helpers.go:125] URL: https://daily-cloudcode-pa.sandbox.googleapis.com/v1internal:streamGenerateContent?alt=sse Trace: 0x497908df95d85353\n",
      "E1119 11:04:28.132092  1696 log.go:354] argument order was not respected: [TargetFile Overwrite] vs [ArtifactMetadata CodeContent Complexity Description EmptyFile IsArtifact Overwrite TargetFile]\n",
      "E1119 11:04:28.144742  1696 log.go:354] argument order was not respected: [TaskName Mode PredictedTaskSize] vs [Mode PredictedTaskSize TaskName TaskStatus TaskSummary]\n",
      "I1119 11:04:28.299759  1696 planner_generator.go:271] Requesting planner with 5 chat messages at model retry attempt 1 and API retry attempt 1\n",
      "I1119 11:04:30.291528  1696 http_helpers.go:125] URL: https://daily-cloudcode-pa.sandbox.googleapis.com/v1internal:streamGenerateContent?alt=sse Trace: 0x869b685fa26a4dc6\n",
      "I1119 11:04:34.169356  1696 http_helpers.go:125] URL: https://daily-cloudcode-pa.sandbox.googleapis.com/v1internal:streamGenerateContent?alt=sse Trace: 0x220c86427aa68ebe\n",
      "E1119 11:04:46.685399  1696 log.go:354] argument order was not respected: [TargetFile Overwrite] vs [ArtifactMetadata CodeContent Complexity Description EmptyFile IsArtifact Overwrite TargetFile]\n",
      "E1119 11:04:46.751983  1696 log.go:354] argument order was not respected: [PathsToReview BlockedOnUser] vs [BlockedOnUser ConfidenceJustification ConfidenceScore Message PathsToReview waitForPreviousTools]\n",
      "I1119 11:04:46.781721  1696 planner_generator.go:271] Requesting planner with 10 chat messages at model retry attempt 1 and API retry attempt 1\n",
      "I1119 11:04:53.830568  1696 http_helpers.go:125] URL: https://daily-cloudcode-pa.sandbox.googleapis.com/v1internal:streamGenerateContent?alt=sse Trace: 0x45644f7dfe014fc1\n",
      "E1119 11:04:58.337460  1696 log.go:354] argument order was not respected: [TaskName Mode PredictedTaskSize] vs [Mode PredictedTaskSize TaskName TaskStatus TaskSummary]\n",
      "E1119 11:04:59.463235  1696 log.go:354] argument order was not respected: [TargetFile] vs [CodeMarkdownLanguage Complexity Description Instruction ReplacementChunks TargetFile]\n",
      "E1119 11:05:18.228536  1696 log.go:354] argument order was not respected: [TargetFile Overwrite] vs [ArtifactMetadata CodeContent Complexity Description EmptyFile IsArtifact Overwrite TargetFile]\n",
      "E1119 11:05:18.279806  1696 log.go:354] argument order was not respected: [TargetFile Overwrite] vs [ArtifactMetadata CodeContent Complexity Description EmptyFile IsArtifact Overwrite TargetFile]\n",
      "I1119 11:05:22.275346  1696 planner_generator.go:271] Requesting planner with 14 chat messages at model retry attempt 1 and API retry attempt 1\n",
      "I1119 11:05:34.390527  1696 http_helpers.go:125] URL: https://daily-cloudcode-pa.sandbox.googleapis.com/v1internal:streamGenerateContent?alt=sse Trace: 0x290890f9850440b6\n",
      "E1119 11:05:40.027781  1696 log.go:354] argument order was not respected: [TaskName Mode PredictedTaskSize] vs [Mode PredictedTaskSize TaskName TaskStatus TaskSummary]\n",
      "E1119 11:05:40.630002  1696 log.go:354] argument order was not respected: [TargetFile] vs [CodeMarkdownLanguage Complexity Description Instruction ReplacementChunks TargetFile]\n",
      "I1119 11:05:41.201701  1696 planner_generator.go:271] Requesting planner with 18 chat messages at model retry attempt 1 and API retry attempt 1\n",
      "I1119 11:05:47.183506  1696 http_helpers.go:125] URL: https://daily-cloudcode-pa.sandbox.googleapis.com/v1internal:streamGenerateContent?alt=sse Trace: 0x180de9efec1205c5\n",
      "I1119 11:05:56.212141  1696 planner_generator.go:271] Requesting planner with 20 chat messages at model retry attempt 1 and API retry attempt 1\n",
      "I1119 11:06:02.745807  1696 http_helpers.go:125] URL: https://daily-cloudcode-pa.sandbox.googleapis.com/v1internal:streamGenerateContent?alt=sse Trace: 0xd74d6446fb4d2db4\n",
      "E1119 11:06:04.437721  1696 log.go:354] argument order was not respected: [TaskName Mode PredictedTaskSize] vs [Mode PredictedTaskSize TaskName TaskStatus TaskSummary]\n",
      "I1119 11:06:05.006946  1696 planner_generator.go:271] Requesting planner with 23 chat messages at model retry attempt 1 and API retry attempt 1\n",
      "I1119 11:06:11.507515  1696 http_helpers.go:125] URL: https://daily-cloudcode-pa.sandbox.googleapis.com/v1internal:streamGenerateContent?alt=sse Trace: 0x6edaba8b51dbca1f\n",
      "I1119 11:06:19.586168  1696 planner_generator.go:271] Requesting planner with 25 chat messages at model retry attempt 1 and API retry attempt 1\n",
      "I1119 11:06:27.202922  1696 http_helpers.go:125] URL: https://daily-cloudcode-pa.sandbox.googleapis.com/v1internal:streamGenerateContent?alt=sse Trace: 0xc9a2e7e19f78fafc\n",
      "E1119 11:06:30.280081  1696 log.go:354] argument order was not respected: [TaskName Mode PredictedTaskSize] vs [Mode PredictedTaskSize TaskName TaskStatus TaskSummary]\n",
      "I1119 11:06:30.371537  1696 planner_generator.go:271] Requesting planner with 28 chat messages at model retry attempt 1 and API retry attempt 1\n",
      "I1119 11:06:37.357590  1696 http_helpers.go:125] URL: https://daily-cloudcode-pa.sandbox.googleapis.com/v1internal:streamGenerateContent?alt=sse Trace: 0x34b4c05b01aef1c0\n",
      "E1119 11:06:40.737103  1696 log.go:354] argument order was not respected: [TaskName Mode PredictedTaskSize] vs [Mode PredictedTaskSize TaskName TaskStatus TaskSummary]\n",
      "E1119 11:06:43.491315  1696 log.go:354] argument order was not respected: [TargetFile] vs [AllowMultiple CodeMarkdownLanguage Complexity Description EndLine Instruction ReplacementContent StartLine TargetContent TargetFile]\n",
      "E1119 11:06:43.551388  1696 log.go:354] argument order was not respected: [TargetFile] vs [AllowMultiple CodeMarkdownLanguage Complexity Description EndLine Instruction ReplacementContent StartLine TargetContent TargetFile]\n",
      "I1119 11:06:47.532855  1696 planner_generator.go:271] Requesting planner with 32 chat messages at model retry attempt 1 and API retry attempt 1\n",
      "I1119 11:06:55.277435  1696 http_helpers.go:125] URL: https://daily-cloudcode-pa.sandbox.googleapis.com/v1internal:streamGenerateContent?alt=sse Trace: 0xad0d8b8f88c1c07d\n",
      "E1119 11:06:56.250789  1696 log.go:354] argument order was not respected: [TaskName Mode PredictedTaskSize] vs [Mode PredictedTaskSize TaskName TaskStatus TaskSummary]\n",
      "I1119 11:06:56.826892  1696 planner_generator.go:271] Requesting planner with 35 chat messages at model retry attempt 1 and API retry attempt 1\n",
      "I1119 11:07:08.618319  1696 http_helpers.go:125] URL: https://daily-cloudcode-pa.sandbox.googleapis.com/v1internal:streamGenerateContent?alt=sse Trace: 0xfd9033c3681b3af9\n",
      "I1119 11:07:08.650075  1696 planner_generator.go:271] Requesting planner with 37 chat messages at model retry attempt 1 and API retry attempt 1\n",
      "I1119 11:07:15.142808  1696 http_helpers.go:125] URL: https://daily-cloudcode-pa.sandbox.googleapis.com/v1internal:streamGenerateContent?alt=sse Trace: 0xeb0780434088e2fb\n",
      "E1119 11:07:16.788384  1696 log.go:354] argument order was not respected: [TaskName Mode PredictedTaskSize] vs [Mode PredictedTaskSize TaskName TaskStatus TaskSummary]\n",
      "E1119 11:07:20.452411  1696 log.go:354] argument order was not respected: [TargetFile] vs [CodeMarkdownLanguage Complexity Description Instruction ReplacementChunks TargetFile]\n",
      "I1119 11:07:20.547218  1696 planner_generator.go:271] Requesting planner with 41 chat messages at model retry attempt 1 and API retry attempt 1\n",
      "I1119 11:07:27.197670  1696 http_helpers.go:125] URL: https://daily-cloudcode-pa.sandbox.googleapis.com/v1internal:streamGenerateContent?alt=sse Trace: 0x5424632dc1968e0f\n",
      "E1119 11:07:38.744054  1696 log.go:354] argument order was not respected: [TargetFile Overwrite] vs [ArtifactMetadata CodeContent Complexity Description EmptyFile IsArtifact Overwrite TargetFile]\n",
      "E1119 11:07:38.801965  1696 log.go:354] argument order was not respected: [PathsToReview BlockedOnUser] vs [BlockedOnUser ConfidenceJustification ConfidenceScore Message PathsToReview waitForPreviousTools]\n"
    ]
  },
  "recentTrajectories": [
    {
      "googleAgentId": "6b60bae8-655a-44e6-92b8-e438ddbf4ed7",
      "trajectoryId": "b5a74efb-a5d0-4085-a2b3-fc4a606f8e6c",
      "summary": "Credit Card Fraud Detection",
      "lastStepIndex": 61,
      "lastModifiedTime": "2025-11-19T05:39:38.514Z"
    }
  ],
  "googleAgentId": "6b60bae8-655a-44e6-92b8-e438ddbf4ed7",
  "currentLatestStepIndex": 61,
  "trajectoryId": "b5a74efb-a5d0-4085-a2b3-fc4a606f8e6c",
  "consoleLogs": [
    "[LOG] 2025-11-19 10:57:22.470 Detected connection failure: [unknown] network error",
    "[ERROR] 2025-11-19 10:57:22.471 got retryable useReactiveState RPC error on attempt [1 / Infinity]:  ConnectError: [unknown] network error",
    "[LOG] 2025-11-19 10:57:22.471 Detected connection failure: [unknown] network error",
    "[ERROR] 2025-11-19 10:57:22.471 got retryable useReactiveState RPC error on attempt [1 / Infinity]:  ConnectError: [unknown] network error",
    "[LOG] 2025-11-19 10:57:22.471 Detected connection failure: [unknown] network error",
    "[ERROR] 2025-11-19 10:57:22.471 Error starting chat client server stream: ConnectError: [unknown] network error",
    "[LOG] 2025-11-19 10:57:39.488 Detected connection failure: [unknown] network error",
    "[ERROR] 2025-11-19 10:57:39.488 got retryable useReactiveState RPC error on attempt [1 / Infinity]:  ConnectError: [unknown] network error",
    "[LOG] 2025-11-19 10:57:39.488 Detected connection failure: [unknown] network error",
    "[ERROR] 2025-11-19 10:57:39.488 Error starting chat client server stream: ConnectError: [unknown] network error",
    "[LOG] 2025-11-19 10:57:39.489 Detected connection failure: [unknown] network error",
    "[ERROR] 2025-11-19 10:57:39.489 got retryable useReactiveState RPC error on attempt [1 / Infinity]:  ConnectError: [unknown] network error",
    "[LOG] 2025-11-19 10:57:42.824 Detected connection failure: [unknown] network error",
    "[ERROR] 2025-11-19 10:57:42.824 got retryable useReactiveState RPC error on attempt [1 / Infinity]:  ConnectError: [unknown] network error",
    "[LOG] 2025-11-19 10:57:42.825 Detected connection failure: [unknown] network error",
    "[ERROR] 2025-11-19 10:57:42.826 got retryable useReactiveState RPC error on attempt [1 / Infinity]:  ConnectError: [unknown] network error",
    "[LOG] 2025-11-19 10:57:42.826 Detected connection failure: [unknown] network error",
    "[ERROR] 2025-11-19 10:57:42.826 Error starting chat client server stream: ConnectError: [unknown] network error"
  ]
}